{
  "$schema": "../../templates/infogenius-social/template.schema.json",
  "contractVersion": "infogenius-social.v1",
  "canvas": {
    "width": 1440,
    "height": 1800,
    "background": "#F3EEE4",
    "ink": "#1D1A17",
    "paper": "#FBF7EF"
  },
  "meta": {
    "artifactId": "ultimate-ai-architecture-2026",
    "grammar": "bounded-system",
    "checkedAt": "2026-08-21",
    "sourceLedger": "sources.json"
  },
  "header": {
    "eyebrow": "INDEPENDENT FIELD GUIDE · CHECKED 21 AUGUST 2026 · NO ENDORSEMENT",
    "title": "The ultimate AI architecture",
    "subtitle": "A production system for multi-agent work",
    "thesis": "Model choice matters. The durable advantage is orchestration, context, trusted action, recovery, and evaluation."
  },
  "sourceImage": "source/ai-architecture-source-v2.png",
  "callouts": [
    {
      "id": "model-gateway",
      "title": "Model gateway",
      "body": "Route by capability, risk, latency, cost, and modality.",
      "side": "left",
      "y": 390,
      "anchor": [500, 430],
      "color": "#2F6BFF",
      "sourceIds": ["openai-agents", "mistral-agents", "xai-multi-agent"]
    },
    {
      "id": "context-memory",
      "title": "Context and memory",
      "body": "Retrieve trusted context; scope and persist memory deliberately.",
      "side": "left",
      "y": 590,
      "anchor": [345, 688],
      "color": "#7452A6",
      "sourceIds": ["anthropic-mcp", "langgraph-docs"]
    },
    {
      "id": "capability-mesh",
      "title": "Capability mesh",
      "body": "Typed tools, APIs, data, code, and retrieval with least privilege.",
      "side": "left",
      "y": 790,
      "anchor": [340, 1000],
      "color": "#167B82",
      "sourceIds": ["anthropic-mcp", "openai-agents", "xai-tools"]
    },
    {
      "id": "durable-runtime",
      "title": "Durable runtime",
      "body": "State, retries, checkpoints; queues, fallback, compensation.",
      "side": "left",
      "y": 990,
      "anchor": [654, 1110],
      "color": "#B87922",
      "sourceIds": ["microsoft-framework", "langgraph-docs", "crewai-docs"]
    },
    {
      "id": "agent-control-plane",
      "title": "Agent control plane",
      "body": "Declare roles, routes, handoffs, budgets, permissions, and stops.",
      "side": "right",
      "y": 390,
      "anchor": [720, 650],
      "color": "#D04B30",
      "sourceIds": ["openai-orchestration", "anthropic-agents"]
    },
    {
      "id": "multi-agent-workshop",
      "title": "Multi-agent workshop",
      "body": "Supervisor, specialists, and reviewer collaborate by contract.",
      "side": "right",
      "y": 590,
      "anchor": [800, 760],
      "color": "#C0841A",
      "sourceIds": ["openai-orchestration", "xai-multi-agent", "google-a2a"]
    },
    {
      "id": "trust-human-approval",
      "title": "Trust and human approval",
      "body": "Policy, identity, scoped action; approvals and audit evidence.",
      "side": "right",
      "y": 790,
      "anchor": [1050, 790],
      "color": "#E5542E",
      "sourceIds": ["anthropic-trust", "microsoft-framework", "meta-responsible"]
    },
    {
      "id": "evals-observability",
      "title": "Evals and observability",
      "body": "Trace quality, cost, latency, failures, drift, and incidents.",
      "side": "right",
      "y": 990,
      "anchor": [730, 1260],
      "color": "#63523F",
      "sourceIds": ["openai-tracing", "microsoft-framework", "crewai-docs"]
    }
  ],
  "gateway": {
    "label": "MODEL GATEWAY",
    "note": "Reference providers · same gateway role · not ranked",
    "slots": [
      { "providerId": "openai", "x": 303 },
      { "providerId": "anthropic", "x": 471 },
      { "providerId": "google", "x": 639 },
      { "providerId": "mistral", "x": 807 },
      { "providerId": "meta", "x": 975 },
      { "providerId": "xai", "x": 1143 }
    ]
  },
  "interoperability": [
    {
      "title": "Open protocols",
      "body": "MCP connects tools and context. A2A connects independent agents.",
      "sourceIds": ["anthropic-mcp", "google-a2a", "a2a-spec"]
    },
    {
      "title": "Runtime choices",
      "body": "Microsoft Agent Framework, LangGraph, and CrewAI add explicit workflows, state, durability, memory, HITL, and observability.",
      "sourceIds": ["microsoft-framework", "langgraph-docs", "crewai-docs"]
    }
  ],
  "providers": [
    {
      "id": "openai",
      "name": "OpenAI",
      "trait": "Agents SDK · managers, handoffs, guardrails, traces",
      "asset": "assets/official/openai-wordmark-trim.png",
      "assetState": "official-use-permitted",
      "sourceIds": ["openai-agents", "openai-orchestration", "openai-tracing", "openai-brand"]
    },
    {
      "id": "anthropic",
      "name": "Anthropic",
      "trait": "Composable workflows · MCP · trustworthy-agent principles",
      "asset": null,
      "assetState": "plain-text-only",
      "sourceIds": ["anthropic-agents", "anthropic-mcp", "anthropic-trust"]
    },
    {
      "id": "google",
      "name": "Google",
      "trait": "ADK ecosystem · A2A interoperability · agent cards and tasks",
      "asset": "assets/official/gemini-app-icon.png",
      "assetState": "official-use-permitted",
      "sourceIds": ["google-a2a", "a2a-spec", "google-brand"]
    },
    {
      "id": "mistral",
      "name": "Mistral AI",
      "trait": "Persistent conversations · built-in tools · handoffs",
      "asset": "assets/official/mistral-icon-trim.png",
      "assetState": "official-use-permitted",
      "sourceIds": ["mistral-agents", "mistral-brand"]
    },
    {
      "id": "meta",
      "name": "Meta Llama",
      "trait": "Open-weight ecosystem · system-level safeguards",
      "asset": null,
      "assetState": "plain-text-only",
      "sourceIds": ["meta-llama", "meta-responsible"]
    },
    {
      "id": "xai",
      "name": "xAI",
      "trait": "Server-side multi-agent · web, X, code, collections",
      "asset": null,
      "assetState": "plain-text-only",
      "sourceIds": ["xai-multi-agent", "xai-tools", "xai-brand"]
    }
  ],
  "footer": {
    "sourceLine": "Official docs and OSS documentation in sources.json · checked 21 August 2026",
    "identityLine": "Independent educational map. Marks belong to their owners. No affiliation, ranking, or endorsement implied.",
    "cta": "Save the system, not just the model list."
  }
}
